sentence_num,ref,hyp,sub,sub_count,del,del_count,ins,ins_count,nochange
494,i chopped off the   tip of my finger while i was cutting some cardboard and i cannot stop the bleeding,i    chop off the thing ** my   fear while i was     cut some     carbo *** i   cant stop the planning,chopped -> chop; tip -> thing; finger -> fear; cutting -> cut; cardboard -> carbo; cannot -> cant; bleeding -> planning,7,of; and,2,,0,11
495,my chest acne breaks out and never clears up,my chest    i breaks out and never clears up,acne -> i,1,,0,,0,8
496,its hard to stand up and * im moving very slowly,its hard to stand up and i am moving very slowly,im -> am,1,,0,i,1,9
497,there is so much pain when  i move my arm,there is so much pain when im   on my arm,i -> im; move -> on,2,,0,,0,8
498,stiffness inability to look right or left except  by moving the whole body,as inability to  low right or left except the   more the whole body,stiffness -> as; look -> low; by -> the; moving -> more,4,,0,,0,9
499,when * get up i found that i have a stomach ache and   i tried to take medecine but my stomach ** still hurting me,when i get up i  fall **** i have a stomach **** and try ***** to make       me but my stomach is still    hurt me,found -> fall; i -> try; take -> make; medecine -> me; hurting -> hurt,5,that; ache; tried,3,i; is,2,15
500,severe pain in the upper left side of ** chest and may have pain **  to back,severe pain in the upper left side of my chest and may have pain in the back,to -> the,1,,0,my; in,2,14
501,i tried to put my glasses to see more clear but cant find any change,i   try to pot my    legs to see  not clear but cant find any change,tried -> try; put -> pot; glasses -> legs; more -> not,4,,0,,0,11
502,i had * alot of exercise yesterday so i feel sharp muscle pains,i had a  lot of      sci yesterday so i feel sharp muscle pains,alot -> lot; exercise -> sci,2,,0,a,1,10
503,my muscles in my lower back are aching,my  muscle in my lower back are aching,muscles -> muscle,1,,0,,0,7
504,there is a  red stain in my skin,there is a rest ***** in my skin,red -> rest,1,stain,1,,0,6
505,i have a pain in  my elbow joint,i have a pain in the elbow joint,my -> the,1,,0,,0,7
506,i read a book for * along time and when i finished reading i feel     head ache,i read a book for a  long time and when i   finish reading i feel headache ****,along -> long; finished -> finish; head -> headache,3,ache,1,a,1,12
507,when i was washing my hair it was ******* falling out heavily,when i was washing my hair it was failing      of the     hea,falling -> of; out -> the; heavily -> hea,3,,0,failing,1,8
508,there is a sharp pain in my bicep i have tried to apply pain relief cream but it does not help,there is a sharp pain in my bicep i have tried to   put pain relief cream but  i dont not help,apply -> put; it -> i; does -> dont,3,,0,,0,18
509,i have pain but i *** cant  specify place,i have pain but i got    a specific place,cant -> a; specify -> specific,2,,0,got,1,6
510,i have this strange rash on my arm,i have this strange rash in my arm,on -> in,1,,0,,0,7
511,i often get a sharp pain in my chest and i cant tell what   im doing that might be triggering it,i often got a sharp pain in my chest *** i  can tell  one long    to **** might be    trigger it,get -> got; cant -> can; what -> one; im -> long; doing -> to; triggering -> trigger,6,and; that,2,,0,13
512,my infected wound caused a fever,my   infect  wont  cause a fever,infected -> infect; wound -> wont; caused -> cause,3,,0,,0,3
513,it feels like someone stuck a knife into my shoulder,its  feel like someone stuck a knife into my shoulder,it -> its; feels -> feel,2,,0,,0,8
514,i need a kind of cream  wich make my muscles more relaxed,i need a  can of cream which make my muscles more relaxed,kind -> can; wich -> which,2,,0,,0,10
515,when i carry heavy things i feel like breaking my back,when i carry    hi things i feel like breaking my back,heavy -> hi,1,,0,,0,10
516,i have disterbance in my emotion,i have disturbance in my emotion,disterbance -> disturbance,1,,0,,0,5
517,my lower back hurts but it improves if i stretch it,my lower back hurts but in progress it * stretch it,it -> in; improves -> progress; if -> it,3,i,1,,0,7
518,my knees swell right below the    knee cap and hurt when i   put weight on them,my knees swell right below the kneecap *** and   or when i pound weight up them,knee -> kneecap; hurt -> or; put -> pound; on -> up,4,cap,1,,0,11
519,when i extend my leg there is * pain in knee joint,when i extend my leg there is a pain in  the joint,knee -> the,1,,0,a,1,10
520,i have injured myself during the soccer match,i have  injure myself during the soccer match,injured -> injure,1,,0,,0,7
521,my hand open *** wound got infected,my hand open one would  in   effect,wound -> would; got -> in; infected -> effect,3,,0,one,1,3
522,i cant really jump on my left foot because my triple fracture of the ankle left   me with neverending pains,i  can really jump on my left foot because my triple fracture on the ankle left mean with       nerve pains,cant -> can; of -> on; me -> mean; neverending -> nerve,4,,0,,0,16
523,i have an ear ache when showering,i have um   a  age when showering,an -> um; ear -> a; ache -> age,3,,0,,0,4
524,i have   a headache every time i eat ice cream,i have had     that every time i eat ice cream,a -> had; headache -> that,2,,0,,0,8
525,there ** feels like a **** swollen knot at my ******** shoulderblade with pain shooting from that,there is  feel like a slow     leg  not on my shoulder         blade with pain shooting firm   to,feels -> feel; swollen -> leg; knot -> not; at -> on; shoulderblade -> blade; from -> firm; that -> to,7,,0,is; slow; shoulder,3,7
526,****** when im awake in the morning i feel strange and have vertigo,doctor when im awake in the morning i feel strange and have vertigo,,0,,0,doctor,1,12
527,my acne is really ************ embarassing its so read,my acne is really embarrassing          it  is so ****,embarassing -> it; its -> is,2,read,1,embarrassing,1,5
528,how  do you ******  know if you have a torn meniscus in your knee,doctor can you please check if   i have a torn meniscus in   my knee,how -> doctor; do -> can; know -> check; you -> i; your -> my,5,,0,please,1,8
529,****** after a ***** breakup i feel something strange in me,doctor after a break      up i feel something strange in me,breakup -> up,1,,0,doctor; break,2,8
530,i hit my head at the basketball game could i have a concussion,i hit my head at the basketball game could i have a  confusion,concussion -> confusion,1,,0,,0,12
531,****** i feel like i just cant cope anymore i feel overwhelmed and like i just cant get a break,doctor i feel like i just cant cope anymore i feel overwhelmed and like i just cant get a break,,0,,0,doctor,1,19
532,is my cut infected or just healing,is my gut infected or just healing,cut -> gut,1,,0,,0,6
533,****** ive got a hard time to  breath am i having a heart attack,doctor ive got a hard time to breathe am i having a heart attack,breath -> breathe,1,,0,doctor,1,12
534,***** theres swelling in my neck and it hurts,there     is swelling in my neck and it hurts,theres -> is,1,,0,there,1,7
535,mr hair is falling out just by combing it,my hair is falling out just by combing it,mr -> my,1,,0,,0,8
536,my face has broken out in painful red spots and lumps that no matter how much i clean my face   dont seem to be going away,my face has broken out in painful red spots and lumps that no matter how much i clean my face doesnt seem to be going away,dont -> doesnt,1,,0,,0,25
537,****** it feels like someone is hitting my head with a hammer i feel pain on the top of my head and it throbs,doctor it feels like someone is hitting my head with a hammer i feel pain on the top of my head and it throbs,,0,,0,doctor,1,23
538,i hit myself and the would doesnt want to heal,i hit myself and the wound  didnt want to hell,would -> wound; doesnt -> didnt; heal -> hell,3,,0,,0,7
539,is pimples a skin disease,its pimples a skin disease,is -> its,1,,0,,0,4
540,my acne itches and  oozes,my acne itches and oodles,oozes -> oodles,1,,0,,0,4
541,****** **** whats the symptoms of appendicitis,doctor what   are the symptoms of appendicitis,whats -> are,1,,0,doctor; what,2,4
542,my heart is pumping fast and im having a hard time to  breath,my heart is pumping fast and im having a hard time to breathe,breath -> breathe,1,,0,,0,12
543,****** *  ive been over my cold for weeks but still cough every day,doctor i have been over my cold for weeks but still cough every day,ive -> have,1,,0,doctor; i,2,11
544,there are lots of hairs on my pillow in the morning,there are lots of  hers on my pillow in the morning,hairs -> hers,1,,0,,0,10
545,dr i feel a strange and powerful pain inside my     rib cage,doctor i feel a strange and powerful pain inside my ribcage ****,dr -> doctor; rib -> ribcage,2,cage,1,,0,9
546,i think ***** theres fluid in my ears,i think there     is fluid in my ears,theres -> is,1,,0,there,1,6
547,i complain * alot with my neck pain and i really need to be better,i complain a  lot with my neck pain and i really need to be better,alot -> lot,1,,0,a,1,13
548,i have a  split on my thumb that will not heal,i have a splint on my thumb that will not heal,split -> splint,1,,0,,0,10
549,i was travelling by ship and i feel dizzy,i was  traveling by ship and i feel dizzy,travelling -> traveling,1,,0,,0,8
550,when i do  hard exercises i feel great pain in my muscles,when i do heart  exercise i feel great pain in my muscles,hard -> heart; exercises -> exercise,2,,0,,0,10
551,i was playing football and injuried with joint pain,i was playing football and  injured with joint pain,injuried -> injured,1,,0,,0,8
552,my grandmother last year went to *** hospital because she was having a hard time breathing,my grandmother last year went to the hospital because she was having a hard time breathing,,0,,0,the,1,15
553,i complain * alot with my neck pain and i really need to be better,i complain a  lot with my neck pain and i really need to be better,alot -> lot,1,,0,a,1,13
554,* im suffering from sharp cough accompanied by phlegm,i am suffering from sharp cough accompanied by phlegm,im -> am,1,,0,i,1,7
555,i cant move my leg there is * pain in the joint,i cant move my leg there is a pain in the joint,,0,,0,a,1,11
556,chronic disease ******* of hair follicles and sebaceous glands,chronic disease disease of hair follicles and       and     se,sebaceous -> and; glands -> se,2,,0,disease,1,6
557,i complain * alot with skin allergy,i complain a  lot with skin allergy,alot -> lot,1,,0,a,1,5
558,i have pimples  in patches along with a lot of redness on my face,i have pimples and patches along with a lot of redness on my face,in -> and,1,,0,,0,13
559,i have tried to  relief it but i cant,i have tried to relieve it but i cant,relief -> relieve,1,,0,,0,8
560,i was playing football and injuried with joint pain,i was playing football and  injured with joint pain,injuried -> injured,1,,0,,0,8
561,i  hve cut my finger because of playing football and i to apply pain relief cream but it does not help,i have cut my finger because of playing football and i to apply pain relief cream but it does not help,hve -> have,1,,0,,0,20
562,i fell a stiffness in my elbows and shoulders,i felt a stiffness in my elbows and shoulders,fell -> felt,1,,0,,0,8
563,i have a cut that has become red and oozes puss,i have a cut that has become red and oozes  pus,puss -> pus,1,,0,,0,10
564,i feel like i went to an acupunctures practice and had one hundred needles in my shoulder,i felt like i went to an acupunctures practice and had one hundred needles in my shoulder,feel -> felt,1,,0,,0,16
565,i toppled over while jumping to catch the ball,i toppled over while      ja to catch the ball,jumping -> ja,1,,0,,0,8
566,i have * severe shoulder pain,i have a severe shoulder pain,,0,,0,a,1,5
567,my skin color on my back is red i dont know why,my skin color on my back is but i dont know why,red -> but,1,,0,,0,11
568,my hair is falling out in * ** * huge amount,my hair is falling out in a in a huge amount,,0,,0,a; in; a,3,8
569,i am worried how cold intolerant i am i am always shivering even out in the sun,i am worried how cold intolerant i am i am always ********* even out in the sun,,0,shivering,1,,0,16
570,i feel fluid trying to come up when i **** * cough,i feel fluid trying to come up when i when i cough,,0,,0,when; i,2,10
571,my head hurts me badly,my head  hurt me badly,hurts -> hurt,1,,0,,0,4
572,i have a foot ache after running **** ******* 500m with my running shoes,i have a foot pack after running five hundred    m with my running shoes,ache -> pack; 500m -> m,2,,0,five; hundred,2,10
573,i made lots and lots of analysis to know the main reason for my stomach ache,i made lots and lots of analysis to know the main reason  of my stomach ache,for -> of,1,,0,,0,15
574,i have front head pain and when i get it the light bothers me,i have   ron head pain and when i get it the light bothers me,front -> ron,1,,0,,0,13
575,i cut my hand a couple of weeks ago and even though i keep using an antibiotic cream ** its not getting better,i cut my hand a couple of weeks ago and even though i keep using an antibiotic cream it  is not getting better,its -> is,1,,0,it,1,21
576,i get an     ear ache when it is cold,i get an earache **** when it is cold,ear -> earache,1,ache,1,,0,7
577,there is pain in my joints i    can not bear pain,there is pain in my joints i cannot *** bear pain,can -> cannot,1,not,1,,0,9
578,even though * im an adult my face keeps breaking out in pimples,even though i am an adult my pace keeps breaking out in pimples,im -> am; face -> pace,2,,0,i,1,10
579,* im having a hard time hearing,i am having a hard time hearing,im -> am,1,,0,i,1,5
580,i have a great pain in my foot like thrombing pain with relaxing my pain releif,i have a great pain in my foot like    thromb pain with relaxing my pain relief,thrombing -> thromb; releif -> relief,2,,0,,0,14
581,oh my heart hurts me i tried to be calm and i cant,oh my heart hurts me i   try to be calm and i cant,tried -> try,1,,0,,0,12
582,my chest  break out with red pimples and whiteheads,my chest breaks out with red pimples and whiteheads,break -> breaks,1,,0,,0,8
583,i cant carry anything i have a pain in my shoulder,i cant carry anything i have * pain in my shoulder,,0,a,1,,0,10
584,i have  throbing in my shoulder,i have throbbing in my shoulder,throbing -> throbbing,1,,0,,0,5
585,my son had his lip pierced and it is swollen and the skin inside on his lip **** is grey and looks infected,my son had his lip pierced and it is swollen and the skin inside on his lip look is gray and looks infected,grey -> gray,1,,0,look,1,21
586,i complain * alot with skin allergy,i complain a  lot with skin allergy,alot -> lot,1,,0,a,1,5
587,i have an internal pain i cannot  describe,i have an internal pain i cannot prescribe,describe -> prescribe,1,,0,,0,7
588,i  m feeling cold though the temperature is high,i am feeling cold    but the temperature is high,m -> am; though -> but,2,,0,,0,7
589,i have a blurry vision since i woke up this morning what could be the reason,i have * blurry vision since i woke up this morning what could be the reason,,0,a,1,,0,15
590,chronic disease of  hair follicles and sebaceous glands,chronic disease of hairs ********* *** ********* ******,hair -> hairs,1,follicles; and; sebaceous; glands,4,,0,3
591,i feel increased heart rate with prick,i feel increased heart rate with  prac,prick -> prac,1,,0,,0,6
592,i cut my hand a couple of days ago and although i didnt think  i needed it stitches it hasnt closed up,i cut my hand a couple ** days ago and although i  dont think it  needs ** stitches it hasnt closed up,didnt -> dont; i -> it; needed -> needs,3,of; it,2,,0,17
593,i have an open wound in my arm,i  had an open wound in my arm,have -> had,1,,0,,0,7
594,i have difficulty in breathing in crowded places,i have difficulty ** breathing in crowded places,,0,in,1,,0,7
595,my kneecap feels like  it    is grating bone on bone when i walk,my kneecap feels like its great ******* bone on bone when i walk,it -> its; is -> great,2,grating,1,,0,10
596,my face  break out badly every month around my cycle,my face breaks out   bad ***** ***** ****** ** *****,break -> breaks; badly -> bad,2,every; month; around; my; cycle,5,,0,3
597,i tried * alot of cream but i still feel the same skin problem,i tried a  lot of cream but i still feel the same skin problem,alot -> lot,1,,0,a,1,12
598,im having a hard time reading because *** the letters are all fuzzy,im having a hard time reading because all the letters are *** fuzzy,,0,all,1,all,1,11
599,there pain in my foot,theres pain in my foot,there -> theres,1,,0,,0,4
600,i have a blurry vision during my swimming training in the pool why,i  had * blurry vision during my swimming training in the pool why,have -> had,1,a,1,,0,11
601,my body feels weak and i tried to make it relax but it stills  pain me,my body feels weak and i tried to make it   wax but it  still pains me,relax -> wax; stills -> still; pain -> pains,3,,0,,0,13
602,chronic bone disease at the level of the doubles of the lower estremidades,chronic bone disease at the level of the doubles ** *** ***** ************,,0,of; the; lower; estremidades,4,,0,9
603,i feel hurt * lot of pain in my heart,i feel hurt a lot of pain in my heart,,0,,0,a,1,9
604,i was playing basketball yesterday i have * sprained ankle,i was playing basketball yesterday i have a sprained ankle,,0,,0,a,1,9
605,i travelled by plane a few days ago and this time during landing my ears remained clogged and painful,i  traveled by plane a few days ago and this time during landing my ears remained clogged and painful,travelled -> traveled,1,,0,,0,18
606,it is hard to  breath when  i am in the underground metro station why,its ** hard to breathe when im ** in the underground metro station why,it -> its; breath -> breathe; i -> im,3,is; am,2,,0,9
607,there pain in my foot,they pain in my foot,there -> they,1,,0,,0,4
608,i fell a stiffness in my elbows and shoulders,i felt a stiffness in my  elbow and shoulders,fell -> felt; elbows -> elbow,2,,0,,0,7
609,i cant move my leg there is * pain in the joint,i cant move my leg there is a pain in the joint,,0,,0,a,1,11
610,i  hve cut my finger because of playing football and i  to apply pain relief cream but it does not help,i have cut my finger because of playing football and i too apply pain relief cream but it does not help,hve -> have; to -> too,2,,0,,0,19
611,i feel a burning sensation in my shoulder muscle,* **** * burning sensation in my shoulder muscle,,0,i; feel; a,3,,0,6
612,i complain * alot with my neck pain  and i really need to be better,i complain a  lot with my neck pain that i really need to be better,alot -> lot; and -> that,2,,0,a,1,12
613,i complain * alot with skin allergy,i complain a  lot with skin allergy,alot -> lot,1,,0,a,1,5
614,i was playing football and injuried with joint pain,i was playing football and  injured with joint pain,injuried -> injured,1,,0,,0,8
615,i have tried to  relief it but i cant,i have tried to relieve it but i cant,relief -> relieve,1,,0,,0,8
616,i got a divorce last year and i just cant stop dwelling   on how to get revenge on my        ex husband,i got a divorce last year and i just cant stop dwelling over how to get revenge on my exhusband *******,on -> over; ex -> exhusband,2,husband,1,,0,18
617,i have a  split on my thumb that will not heal,i have a splint on my thumb that will not heal,split -> splint,1,,0,,0,10
618,i have a cut that has become red and oozes puss,i have a cut that has become red and oozes  pus,puss -> pus,1,,0,,0,10
619,when i do  hard exercises i feel great pain in my muscles,when i do heart exercises i feel great pain in my muscles,hard -> heart,1,,0,,0,11
620,i feel discomfort throughout the body in general,i feel discomfort throughout  my body in general,the -> my,1,,0,,0,7
621,my muscle  in my shoulder burns when i move my arm,my muscle and my shoulder burns when i move my arm,in -> and,1,,0,,0,10
622,im suffering from * sharp cough accompanied by phlegm,im suffering from a sharp cough accompanied by phlegm,,0,,0,a,1,8
623,i cant carry anything i have a pain in my shoulder,i cant carry anything i have * pain in my shoulder,,0,a,1,,0,10
624,i feel pain in my right shoulder after the tennis match,i felt pain in my right shoulder after the tennis match,feel -> felt,1,,0,,0,10
625,i may have **** overdone it with the ****** weightlifting because  i am afraid i may have torn   a muscle on my back,i may have over     done it with the weight       lifting because im up     we i may have torn and muscle on my back,overdone -> done; weightlifting -> lifting; i -> im; am -> up; afraid -> we; a -> and,6,,0,over; weight,2,15
626,sometimes my body feels week without reason,sometimes my body feels weak without reason,week -> weak,1,,0,,0,6
627,my heart hurts while  im sad why,my heart hurts   why and and why,while -> why; im -> and; sad -> and,3,,0,,0,4
628,i had internal pain and  gases when i ate indian spicy food yesterday,i had internal pain and gasses when i ate indian spicy food yesterday,gases -> gasses,1,,0,,0,12
629,i have found some  issues in my skin and tried to use cream but it **** doesnt get better,i have found some tissues on my skin and tried to use cream but it does    not get better,issues -> tissues; in -> on; doesnt -> not,3,,0,does,1,15
630,my child has cough all night she cant sleep,my child has cough all night she cant   see,sleep -> see,1,,0,,0,8
631,i have a headache almost every day,i have a headache almost every ***,,0,day,1,,0,6
632,in **** highschool i had a lot of acne,in high     school i had a lot of    a,highschool -> school; acne -> a,2,,0,high,1,6
633,my body feels weak although i eat a   lot why,my body feels weak although i eat a while ***,lot -> while,1,why,1,,0,8
634,im very worried that ill go bald soon am i very sick,im very worried that ill go   by   so am i very sick,bald -> by; soon -> so,2,,0,,0,10
635,**** ***** my  kee is swallowing which indicates i have an infected wound,yeah right my knee is    swallow which indicates i have an infected wound,kee -> knee; swallowing -> swallow,2,,0,yeah; right,2,9
636,is there a cure for ** acne,is  that a cure for it   no,there -> that; acne -> no,2,,0,it,1,4
637,having difficulty moving my  knee,having difficulty moving my knees,knee -> knees,1,,0,,0,4
638,i used * alot of pain killer to get better but i still feel the same back pain,i used a  lot of pain killer to get better but i still feel the same back pain,alot -> lot,1,,0,a,1,16
639,my ankle joint throbs when i put pressure on my foot,my ankle joint  drops when i put pressure on my foot,throbs -> drops,1,,0,,0,10
640,i feel like i can hardly breathe unless i get whats in my lungs out,i feel like i can hardly breathe unless i get warts in my lungs  or,whats -> warts; out -> or,2,,0,,0,13
641,i always feel like i have menstrual     pains even if i dont have    my period,yeah   this feel like i have        my insurance even if i dont    i might     be,i -> yeah; always -> this; menstrual -> my; pains -> insurance; have -> i; my -> might; period -> be,7,,0,,0,8
642,i ***** couldnt stop shaking or unclench my jaw thats how cold i was,i could     not stop shaking or unclench my jaw thats how cold i was,couldnt -> not,1,,0,could,1,12
643,i feel like *  ive always got something in my throat,i feel like i have always got something in my throat,ive -> have,1,,0,i,1,9
644,i *** feel aching on my insides,i did    a   tube on my insides,feel -> a; aching -> tube,2,,0,did,1,4
645,my foot had been aching since last tuesday,my food had been aching since last tuesday,foot -> food,1,,0,,0,7
646,i cut my foot at the pool and it breaks ** open every day when i walk on   it,i cut my foot at the food and it breaks so  far every day when i walk on this,pool -> food; open -> far; it -> this,3,,0,so,1,15
647,i have a  migrain and i took panadol but it doesnt help,i have a migraine and i took panadol but it     does  not,migrain -> migraine; doesnt -> does; help -> not,3,,0,,0,9
648,there is a sharp pain in my **** bicep i have tried to apply pain relief cream but it does not help,there is a sharp pain in my legs    so i have tried to apply pain relief ***** but it does not ****,bicep -> so,1,cream; help,2,legs,1,18
649,my shoulder aches when i try to lift five pounds,my shoulder aches when i try to lift five    lbs,pounds -> lbs,1,,0,,0,9
650,*  ive always been very active but now i just dont have the strength or energy to go for even a short walk,i have always been very active but now * just dont have *** strength or energy to go for even a short walk,ive -> have,1,i; the,2,i,1,19
651,i cant walk my  knee hurts me,i cant walk my knees  hurt me,knee -> knees; hurts -> hurt,2,,0,,0,5
652,my hair always falls out and i have lost a lot of hair lately,my hair always falls off and i have lost a lot of hair lately,out -> off,1,,0,,0,13
653,i have a problem in my middle ear made by infection,i have a problem in my middle ear  leg by infection,made -> leg,1,,0,,0,10
654,i hardly have enough  stength to get up,i hardly have enough strength to get up,stength -> strength,1,,0,,0,7
655,i feel pain inside and i    can not identify it,i feel pain inside and i cannot *** identify it,can -> cannot,1,not,1,,0,8
656,longitudinal burning line across back    with hard respiratory movements,longitudinal burning line across back without **** respiratory movements,with -> without,1,hard,1,,0,7
657,there are times when i feel crushed under a huge weight and no air passing to my lungs it actually scares the hell out of me when it happens,there are times when i feel crushed under * huge     we and no air passing to my lungs it actually spares the hell out of me when it happens,weight -> we; scares -> spares,2,a,1,,0,26
658,heart aches so much,hurt aches so much,heart -> hurt,1,,0,,0,3
