sentence_num,ref,hyp,sub,sub_count,del,del_count,ins,ins_count,nochange
1305,i *** dont have full range of motion with my arms,i don    t have full range of motion with my arms,dont -> t,1,,0,don,1,9
1306,i have a great stomach ache and i cant eat      any thing,i have a great stomach ache and i cant eat anything *****,any -> anything,1,thing,1,,0,10
1307,my shoulder has * * agreat pain,my shoulder has g a  great pain,agreat -> great,1,,0,g; a,2,4
1308,i am worried     for my driving because i can barely focus when i      am at the wheel my eyes feel   teary,im ** worried through my driving because i can barely focus  and i believe ** *** ***** my eyes  get tearing,i -> im; for -> through; when -> and; am -> believe; feel -> get; teary -> tearing,6,am; at; the; wheel,4,,0,11
1309,i  notice a lot more hair coming out than usual when i brush my hair,i noticed a lot more hair coming out than usual when i brush my hair,notice -> noticed,1,,0,,0,14
1310,my hair always falls out and i have lost a lot of hair lately,my hair always falls out and i have lost a lot of hair weight,lately -> weight,1,,0,,0,13
1311,when i walk i get a stabbing pain in the top of my foot,when i walk i get * stabbing pain in the top of my foot,,0,a,1,,0,13
1312,i    feel sad like hurt or pain,of feeling sad like hurt or pain,i -> of; feel -> feeling,2,,0,,0,5
1313,the worst headache was during a hangover in my twenties i sincerely thought i was going to die from brain inflammation,the worst headache was during a hangover in my     legs i sincerely thought i was going to die from brain inflammation,twenties -> legs,1,,0,,0,20
1314,my shoulder aches when i try to lift five pounds,my shoulder aches when i try to lift five    lbs,pounds -> lbs,1,,0,,0,9
1315,my cough is very heavy and i have mucus,my  calf is very heavy and i have mucus,cough -> calf,1,,0,,0,8
1316,sometimes my body feels week without reason,sometimes my body feels weak without      a,week -> weak; reason -> a,2,,0,,0,5
1317,in **** highschool i had a lot of acne,in high     school i had a lot of acne,highschool -> school,1,,0,high,1,7
1318,i feel cold when the night  comes,i feel cold when the night counts,comes -> counts,1,,0,,0,6
1319,i wish this excruciating feeling of loss could go away,i wish this excruciating feeling of loss would go away,could -> would,1,,0,,0,9
1320,i cant work good i have a pain in my knee,i cant work good i have * pain in my knee,,0,a,1,,0,10
1321,i walked a long for three        km i feel pain in my foot like foot ache,i walked a long *** three kilometer i feel pain in my foot like foot ache,km -> kilometer,1,for,1,,0,14
1322,my throught is so sore,my   throat is so sore,throught -> throat,1,,0,,0,4
1323,my body feels weak although i eat   a  lot why,my body feels weak although i did not like ***,eat -> did; a -> not; lot -> like,3,why,1,,0,6
1324,everything looks like beeing in a smoky area,everything looks like  being in a smoky area,beeing -> being,1,,0,,0,7
1325,i may have overdone it with the ****** weightlifting because  i am afraid i may have torn a muscle on my back,i may have overdone it with the weight       lifting because im ** afraid i may have torn a muscle on my back,weightlifting -> lifting; i -> im,2,am,1,weight,1,18
1326,i have a red rash that is itchy on my skin,i have a red rash that is itchy by my skin,on -> by,1,,0,,0,10
1327,i have a problem in my middle ear made by infection,i have a problem in my middle ear near my  incision,made -> near; by -> my; infection -> incision,3,,0,,0,8
1328,these red spots on my cheeks are  new what is it,these red spots on my cheeks are here what is it,new -> here,1,,0,,0,10
1329,have severe cold and cough,how severe cold and cough,have -> how,1,,0,,0,4
1330,i have a wound between my toes that gets better overnight and then ** reopens  ever day when i wear   dress shoes to work,i have a wound between my toes that gets better overnight and then it   opens every day when i need tissues ***** to work,reopens -> opens; ever -> every; wear -> need; dress -> tissues,4,shoes,1,it,1,18
1331,i had internal pain and  gases when i ate indian spicy food yesterday,i had internal pain and gasses  and i ate indian spicy food yesterday,gases -> gasses; when -> and,2,,0,,0,11
1332,my head is so heavy * cant think normally,my head is so heavy i cant think normally,,0,,0,i,1,8
1333,the feeling of coughing increases in winters reach,the feeling of coughing increases in  mental  rage,winters -> mental; reach -> rage,2,,0,,0,6
1334,*  ive noticed my hair falling out a lot lately,i have noticed my hair falling out a lot lately,ive -> have,1,,0,i,1,8
1335,after an hard working day i have foot ache,after  a hard working day i have   to take,an -> a; foot -> to; ache -> take,3,,0,,0,6
1336,every time i make an ** effort i felt dizzy,every time i make an ne  fruit i feel dizzy,effort -> fruit; felt -> feel,2,,0,ne,1,7
1337,i have a foot ache after running **** ******* 500m with my running shoes,i have a foot ache after running five hundred    m with my running shoes,500m -> m,1,,0,five; hundred,2,11
1338,my head hurts me badly,my  hip hurts me badly,head -> hip,1,,0,,0,4
1339,i feel a sharp pain in the stomach after eating,i feel a sharp pain in the stomach    of      a,after -> of; eating -> a,2,,0,,0,8
1340,my ankle joint throbs when i put pressure on my foot,my ankle joint  hurts when i put pressure on my foot,throbs -> hurts,1,,0,,0,10
1341,my cut yellow or ******** greenishcolored pus,my cut yellow or greenish         colored   p,greenishcolored -> colored; pus -> p,2,,0,greenish,1,4
1342,*  ive tried reading books but nothing can cheer me up,i have tried trading books but nothing can share me **,ive -> have; reading -> trading; cheer -> share,3,up,1,i,1,6
1343,i have whooping cough with excess mucous need mucolytic,i have whooping cough with excess  mucus need mucolytic,mucous -> mucus,1,,0,,0,8
1344,i have a rash on my skin,i  had a rash on my skin,have -> had,1,,0,,0,6
1345,i cut my foot at the pool and    it breaks open every day when i walk on it,i cut my foot at the pool and break     so **** every day when i walk ** **,it -> break; breaks -> so,2,open; on; it,3,,0,13
1346,the arches of my feet hurt when i wear   heels,the arches of my feet hurt when i wear periods,heels -> periods,1,,0,,0,9
1347,i feel emotionally crushed,i feel emotionally crossed,crushed -> crossed,1,,0,,0,3
1348,i used * alot of       pain killer to get better but i still feel the same back pain,i used a  lot of painkiller ****** to get better but i still feel the same back pain,alot -> lot; pain -> painkiller,2,killer,1,a,1,14
1349,i feel like   l fell in hot water,i feel like ive fell in hot water,l -> ive,1,,0,,0,7
1350,* im not feeling good i get * infection wound,i am not feeling good i get a infection  when,im -> am; wound -> when,2,,0,i; a,2,6
1351,my     head ache since i woke up this morning,my headache **** since i woke up this morning,head -> headache,1,ache,1,,0,7
1352,every time i look to left i feel a sharp pain in my neck,every time i talk to left i feel a sharp pain in my neck,look -> talk,1,,0,,0,13
1353,the last time i clipped my toenails i cut them too short and now i have an infected nail,the last time i clipped my toenails i cut them  to short and now i have an infected nail,too -> to,1,,0,,0,18
1354,im very worried that ill go bald soon am i very sick,im very worried that ill go   bo soon am i very sick,bald -> bo,1,,0,,0,11
1355,i get breakouts on my chest with    red patches that get more intense when i get hot,i get breakouts on my chest with bright patches that get more intense when i get hot,red -> bright,1,,0,,0,16
1356,my son had a root canal and the dentist accidentally cut the inside of his cheek and now it will not heal,my son had a root canal and the dentist accidentally cut the inside of his sheet and now it will not heal,cheek -> sheet,1,,0,,0,21
1357,i noticed an important decrease in my vision when i try to look at things up close,i noticed an important decrease in my vision when i try to look at things up *****,,0,close,1,,0,16
1358,i feel pain inside and i    can not identify it,i feel pain inside and i cannot *** identify it,can -> cannot,1,not,1,,0,8
1359,i cant do anything i feel a weak in my body,i cant do anything i feel * weak in my body,,0,a,1,,0,10
1360,i cant stop ***** coughing,i cant stop cough    fight,coughing -> fight,1,,0,cough,1,3
1361,when i tried to take care if my hair i found that it  is falling out,when i   try to take care of my hair i found that it was falling out,tried -> try; if -> of; is -> was,3,,0,,0,13
1362,i couldnt stop shaking or *** unclench my jaw thats how cold i was,i couldnt stop shaking or and   clench my jaw thats how cool i was,unclench -> clench; cold -> cool,2,,0,and,1,11
1363,my body feels weak and i think that my face is   fade and i cant sleep well,my body feels weak and i think that my face is afraid and i cant sleep well,fade -> afraid,1,,0,,0,16
1364,i feel *** pain in the knee,i feel the pain in the knee,,0,,0,the,1,6
1365,i hardly have enough  stength to get up,i hardly have enough strength to get up,stength -> strength,1,,0,,0,7
1366,my  kee is swallowing which indicates i have an infected wound,my knee is swallowing which indicates i have an infected wound,kee -> knee,1,,0,,0,10
1367,i suffered a deep wound in my hand and i    can not stop the bleeding,i   suffer a deep  bone in my hand and i cannot *** stop *** bleeding,suffered -> suffer; wound -> bone; can -> cannot,3,not; the,2,,0,10
1368,sterilizer for the eye,still for the eye,sterilizer -> still,1,,0,,0,3
1369,im not hearing well i have * problem with my ear,im not hearing well i have a problem with my ear,,0,,0,a,1,10
1370,hearing any loud sounds makes my ear aches,hearing any loud sounds makes my ear  ache,aches -> ache,1,,0,,0,7
1371,i get big patches of irritated pimples on my back and they hurt,i get big patches of        rd pimples on my back and they hurt,irritated -> rd,1,,0,,0,12
1372,longitudinal burning line across back    with hard respiratory movements,longitudinal burning line across back without **** respiratory movements,with -> without,1,hard,1,,0,7
1373,my daughter was bit by her  cat and now her hand is sore red and swollen and the wound is  oozing liquid,my daughter was bit by her gait and now her hand is sore red and swollen and the wound is pushing liquid,cat -> gait; oozing -> pushing,2,,0,,0,20
1374,i feel a **** ** boneonbone pain in my knees when i climb stairs,i feel a bone on       bone pain in my knees when i climb stairs,boneonbone -> bone,1,,0,bone; on,2,11
1375,my hair is coming out in chunks especially when i wash it,my hair is coming out in chance especially when i wash it,chunks -> chance,1,,0,,0,11
1376,when i stand up too quick my vision is blurry,when i stand up  to   pee my vision is blurry,too -> to; quick -> pee,2,,0,,0,8
1377,*  ive got a hard time to breath am i having a heart attack,i have got a hard time to breath am i having a heart attack,ive -> have,1,,0,i,1,12
1378,i cant  breath because of cough,i cant breathe because of cough,breath -> breathe,1,,0,,0,5
1379,my foot hurts and i cant turn it maybe ** its broken,my foot hurts and i cant turn it maybe it  is broken,its -> is,1,,0,it,1,10
1380,when i remember her i  feel down,when i remember her i kneel down,feel -> kneel,1,,0,,0,6
1381,i have a dull  ache in my lower back which makes it difficult to move,i have a dull itchy in my lower back which makes it difficult to move,ache -> itchy,1,,0,,0,14
1382,i had a cut that was stitched together but ** it is not healing it is oozing green puss and burns,i had a cut that was      tea together but uh it is not healing it is oozing green push and burns,stitched -> tea; puss -> push,2,,0,uh,1,18
1383,since i went into the forest i have pain on my ear,since i went into the forest i have been on my ear,pain -> been,1,,0,,0,11
1384,i have a pain that radiates up from my right hip to my rib cage it is at its worst when i *** **** urinate,i have a pain that radiates up from my right hip to my rib cage it is at its worst when i you need      it,urinate -> it,1,,0,you; need,2,22
1385,*  ive been feeling very sad lately,i have been feeling very sad lately,ive -> have,1,,0,i,1,5
1386,even though * im  an   adult my face keeps breaking out ** in pimples,even though i  a man tattled my face    is   taking out it in pimples,im -> a; an -> man; adult -> tattled; keeps -> is; breaking -> taking,5,,0,i; it,2,7
1387,i cut my finger opening     a can    it wont stop bleeding and the wound is  gaping and open,i cut my finger opening again  it would  not stop bleeding and the wound is keeping and open,a -> again; can -> it; it -> would; wont -> not; gaping -> keeping,5,,0,,0,13
1388,there is pain in my joints i    can not bear pain,there is pain in my joints i cannot *** bear pain,can -> cannot,1,not,1,,0,9
1389,my sore looks like its not healing well,my   so looks like its not healing well,sore -> so,1,,0,,0,7
1390,*  ive been over my cold for weeks but still cough every day,i have been over my cold for weeks but still cough every day,ive -> have,1,,0,i,1,11
1391,i think ***** theres something wrong with my wound it does not seem to heal like it should,i think there     is something wrong with my bound it does not seem to heal like it should,theres -> is; wound -> bound,2,,0,there,1,15
1392,i have an indigestion,i have an  invitation,indigestion -> invitation,1,,0,,0,3
1393,i have a great pain in my foot like thrombing pain with relaxing my pain releif,i have a great pain in my foot like  thrombin pain with relaxing my pain relief,thrombing -> thrombin; releif -> relief,2,,0,,0,14
1394,when * im awake in the morning i feel strange and have vertigo,when i am awake in the morning i feel strange and have vertigo,im -> am,1,,0,i,1,11
1395,my knee **** doesnt want to bend well,my knee does    not want to bend well,doesnt -> not,1,,0,does,1,6
1396,every morning when i wake up my neck feels like i slept on in wrong,every morning when i wake up my neck feels like i slept on ** wrong,,0,in,1,,0,14
1397,after *     a breakup i feel something strange in me,after i break      up i feel something strange in me,a -> break; breakup -> up,2,,0,i,1,7
1398,my ear hurts and its worse when i swallow my ear is very painful and *** ****** *** tylenol hasnt helped,my ear hurts and its worse then i swallow my ear is very painful and tea really not     has   not helped,when -> then; tylenol -> has; hasnt -> not,3,,0,tea; really; not,3,15
1399,the pain in my back dwwls like a sharp knife  in it,the pain in my back   was like a sharp knife and it,dwwls -> was; in -> and,2,,0,,0,10
1400,i feel a strange and powerful pain inside my     rib cage,i feel a strange and powerful pain inside my ribcage ****,rib -> ribcage,1,cage,1,,0,9
1401,my body feels weak after my first day in the gym why,my body feels weak after my first day in the gym   y,why -> y,1,,0,,0,11
1402,i feel like there is something swollen and ** inflamed at the back of my knee,i feel like there is something swollen and uh inflamed at the back of my knee,,0,,0,uh,1,15
1403,when i stand up too quickly i feel as though * im going  to faint,when i stand up too quickly i feel as though i am going too faint,im -> am; to -> too,2,,0,i,1,12
1404,severe pain in the ear,sever pain in the ear,severe -> sever,1,,0,,0,4
1405,what helps cuts heal faster,what helps guts heal faster,cuts -> guts,1,,0,,0,4
1406,surgical wounds  red firing pus painful and hot to the touch,surgical wounds read firing  pu painful and hot to the touch,red -> read; pus -> pu,2,,0,,0,9
1407,i broke my ankle while doing rock climbing in the ****** carpathians,i broke my ankle while doing rock climbing in the carpet       hills,carpathians -> hills,1,,0,carpet,1,10
1408,i have a cut that has become red and oozes puss,i have a   z **** has ****** red and ***** ****,cut -> z,1,that; become; oozes; puss,4,,0,6
1409,i have  a split on my thumb that will not heal,i have it ***** on my     s that will not heal,a -> it; thumb -> s,2,split,1,,0,8
1410,i complain * alot with skin allergy,i complain a  lot with skin allergy,alot -> lot,1,,0,a,1,5
1411,i feel discomfort throughout the body in general,i feel discomfort      throw the body in general,throughout -> throw,1,,0,,0,7
1412,chronic disease of   hair follicles and sebaceous glands,chronic disease of higher follicles *** sebaceous  gland,hair -> higher; glands -> gland,2,and,1,,0,5
1413,i cut my hand a couple of days ago and although i didnt think i needed it  stitches it hasnt closed up,i cut my hand a couple of days ago and    those i didnt think i needed it stitching it hasnt closes up,although -> those; stitches -> stitching; closed -> closes,3,,0,,0,19
1414,i have tried to  relief it but i cant,i have tried to relieve it but i cant,relief -> relieve,1,,0,,0,8
1415,when i do  hard exercises i feel great pain in my muscles,when i do heart exercises i feel great pain in my muscles,hard -> heart,1,,0,,0,11
1416,i feel dizzy after doing  a muscular effort,i feel dizzy after going on      off ******,doing -> going; a -> on; muscular -> off,3,effort,1,,0,4
1417,i have difficulty moving my neck,i have  difficult moving my neck,difficulty -> difficult,1,,0,,0,5
1418,i feel dizzy after severe diarrhea,what   is    uh after ****** ********,i -> what; feel -> is; dizzy -> uh,3,severe; diarrhea,2,,0,1
1419,i feel pain in my head with   a vertigo,i feel pain in my head with the vertigo,a -> the,1,,0,,0,8
1420,i have     a foot ache in winter   or when it feels cold why,my neck hurts   me  and  i   cant look down or    up **** ***,i -> my; have -> neck; a -> hurts; foot -> me; ache -> and; in -> i; winter -> cant; or -> look; when -> down; it -> or; feels -> up,11,cold; why,2,,0,0
1421,i feel like the room is spinning,ok **** **** the room is       in,i -> ok; spinning -> in,2,feel; like,2,,0,3
1422,i feel pain in my neck while im working,that  the pain in my neck where im walking,i -> that; feel -> the; while -> where; working -> walking,4,,0,,0,5
1423,my   back got injured   while    i was lifting at the gym,my friend got      in uruguay were not   again ** *** ***,back -> friend; injured -> in; while -> uruguay; i -> were; was -> not; lifting -> again,6,at; the; gym,3,,0,2
1424,i cant sleep because  of cough,i  can sleep     you got     a,cant -> can; because -> you; of -> got; cough -> a,4,,0,,0,2
1425,i have a cold and  it makes  me cough alot,i have a  cow and get    my cow  long ****,cold -> cow; it -> get; makes -> my; me -> cow; cough -> long,5,alot,1,,0,4
1426,*   my abdominal muscles have great pain since i *** ** *   was  at  gym,i feel         a    pain   in    my back  when i sit on a chair for long,my -> feel; abdominal -> a; muscles -> pain; have -> in; great -> my; pain -> back; since -> when; was -> chair; at -> for; gym -> long,10,,0,i; sit; on; a,4,1
1427,i cant   see well,i cant sleep well,see -> sleep,1,,0,,0,3
1428,i feel great pain in my feet after playing one of      the sports games,* **** ***** **** in my **** ***** ******* one is fourteen ****** *****,of -> is; the -> fourteen,2,i; feel; great; pain; feet; after; playing; sports; games,9,,0,3
1429,there   is  a red stain in   my skin,now your so you  have  a pain ****,there -> now; is -> your; a -> so; red -> you; stain -> have; in -> a; my -> pain,7,skin,1,,0,0
1430,*** anytime i play tennis i feel a shoulder pain,any    time i play tennis i feel * shoulder pain,anytime -> time,1,a,1,any,1,7
1431,i lose    a lot of my hair,i    i lost *** ** my ****,lose -> i; a -> lost,2,lot; of; hair,3,,0,2
1432,my infected wound caused a fever,my infected wound caused * fever,,0,a,1,,0,5
1433,***** my muscles in my lower back are aching,there is    acne on my  face **** *** ******,my -> is; muscles -> acne; in -> on; lower -> face,4,back; are; aching,3,there,1,1
1434,** there is acne on my face,uh there is acne on my face,,0,,0,uh,1,6
1435,ive had this cough for two weeks,i had   he    co for two weeks,ive -> i; this -> he; cough -> co,3,,0,,0,4
1436,i **** **** ****    have   a  pain internal,i feel pain went parting the loved      one,have -> parting; a -> the; pain -> loved; internal -> one,4,,0,feel; pain; went,3,1
1437,i   do not feel better in my muscles,it will not feel better in my  muscle,i -> it; do -> will; muscles -> muscle,3,,0,,0,5
1438,i feel a huge emotional pain after i broke up with my girlfriend,i feel i feel ********* **** ***** i broke up with my    friends,a -> i; huge -> feel; girlfriend -> friends,3,emotional; pain; after,3,,0,7
1439,i feel    that its hard to breath for me specially after running or making any effort,at   my surgery *** **** ** ****** *** ** ********* after running um ****** any asthma,i -> at; feel -> my; that -> surgery; or -> um; effort -> asthma,5,its; hard; to; breath; for; me; specially; making,8,,0,3
1440,i cant move  my head up and down,i  can move her **** up and down,cant -> can; my -> her,2,head,1,,0,5
1441,my shoulder muscle hurts when i try to reach up,not        a  month   ago **** * *** ** ***** **,my -> not; shoulder -> a; muscle -> month; hurts -> ago,4,when; i; try; to; reach; up,6,,0,0
1442,i used to be out of breath after going up a dozen   of stairs but     now i struggle to breath even when i sit down,i feel ** ** *** ** ****** ***** ***** ** a sharp pain     in  my stomach * ******** ** ****** **** **** * *** ****,used -> feel; dozen -> sharp; of -> pain; stairs -> in; but -> my; now -> stomach,6,to; be; out; of; breath; after; going; up; i; struggle; to; breath; even; when; i; sit; down,17,,0,2
1443,my infected wound  cause fever,my infected wound caused fever,cause -> caused,1,,0,,0,4
1444,when i carry heavy things  i feel like breaking      my back,**** i  feel  pain     in my head with      the vertigo ****,carry -> feel; heavy -> pain; things -> in; i -> my; feel -> head; like -> with; breaking -> the; my -> vertigo,8,when; back,2,,0,1
1445,i used to have acne when i was fifteen years old,i used to have   an when * *** fifteen years ***,acne -> an,1,i; was; old,3,,0,7
1446,i feel head     ache,i feel    a headache,head -> a; ache -> headache,2,,0,,0,2
1447,i have pain ** but    i cant specify   place,i feel pain in  my head with     the vertigo,have -> feel; but -> my; i -> head; cant -> with; specify -> the; place -> vertigo,6,,0,in,1,2
1448,it hurts when i bent my arm,it hurts when i bend my arm,bent -> bend,1,,0,,0,6
1449,the feeling of coughing increases in winters reach,the feeling of coughing increases in  winter reach,winters -> winter,1,,0,,0,7
1450,i am worried for my driving because i can barely focus when  i am at the wheel my eyes feel teary,i am worried for my driving because i can barely focus when im ** at the wheel my eyes feel teary,i -> im,1,am,1,,0,19
1451,there is a sharp pain in my calve,there is a sharp pain in my   car,calve -> car,1,,0,,0,7
1452,i never had any acne problem until my last pregnancy when all of a sudden my back got covered in zits,i never had any acne problem until my last pregnancy when all of a sudden my back got covered in this,zits -> this,1,,0,,0,20
1453,after an        hard working day i have foot ache,after an hardworking ******* day i have foot ache,hard -> hardworking,1,working,1,,0,7
1454,i have a    foot ache after running **** ******* 500m with my running shoes,i have a footage **** after running five hundred    m with my running shoes,foot -> footage; 500m -> m,2,ache,1,five; hundred,2,9
1455,when i tried to answer the phine call i found that i cant hear the voice of the speaker,when i tried to answer the phone call i found that i  can hear the voice of the speaker,phine -> phone; cant -> can,2,,0,,0,17
1456,when i walk its hard to  breath,when i walk its hard to breathe,breath -> breathe,1,,0,,0,6
1457,i walked     a long for three         km i feel pain in my foot like foot ache,i walked along **** for three kilometers i feel pain in my foot like foot   ae,a -> along; km -> kilometers; ache -> ae,3,long,1,,0,12
1458,when i go to sleep  i am feeling cold,when i go to sleep im ** feeling cold,i -> im,1,am,1,,0,7
1459,i have * severe shoulder pain,i have a severe shoulder pain,,0,,0,a,1,5
1460,i have * whooping cough with excess mucous need mucolytic,i have a whooping cough with excess  mucus near mucolytic,mucous -> mucus; need -> near,2,,0,a,1,7
1461,i am worried how cold ****** intolerant i am  i am always shivering even out in the sun,i am worried how cold indoor        and i am im ** always shivering even out in the sun,intolerant -> and; i -> im,2,am,1,indoor,1,14
1462,my daughter had her ears pierced and ** one of her ear lobes is bright red and burning hot,my daughter had her ears pierced and uh one of her ear lobes is bright red and burning hot,,0,,0,uh,1,18
1463,i get  i joint pain when i try to bend my leg or my arm,i get uh joint pain when i try to bend my leg or my arm,i -> uh,1,,0,,0,14
1464,i have a wound between my toes that gets better overnight and then reopens  ever day when i wear dress shoes to work,i have a wound between my toes that gets better overnight and then reopens every day when i wear  rush shoes to work,ever -> every; dress -> rush,2,,0,,0,21
1465,cramps along the whole abdomen,cramps along the  oral abdomen,whole -> oral,1,,0,,0,4
1466,my son nicked his neck with an old razor and that spot has become inflamed and looks like it is infected,my son nicked his neck with an old  bier and that spot has become inflamed and looks like it is infected,razor -> bier,1,,0,,0,20
1467,i have * general discomfort in my torso,i have a general discomfort in my torso,,0,,0,a,1,7
1468,my cut yellow or ******** greenishcolored  pus,my cut yellow or greenish         colored puff,greenishcolored -> colored; pus -> puff,2,,0,greenish,1,4
1469,*  ive noticed my hair falling out a lot lately,i have noticed my hair falling out a lot lately,ive -> have,1,,0,i,1,8
