sentence_num,ref,hyp,sub,sub_count,del,del_count,ins,ins_count,nochange
983,there feels like a swollen knot at my ******** shoulderblade with pain shooting from that,that feels like a swollen   nt at my shoulder         blade with pain shooting from that,there -> that; knot -> nt; shoulderblade -> blade,3,,0,shoulder,1,11
984,my daughter had her eyebrows threaded and  it pulled an opening of skin in one of her brows that is now puffy and oozing,my daughter had her eyebrows threaded and put ****** an opening of skin in one of her brows that is now puffy and oozing,it -> put,1,pulled,1,,0,22
985,the nerves were so damaged during the operation on my ankle that i cannot stand being touched on the scar,the nerves were so damaged during the operation on my ankle that i cannot stand being touched on the  sky,scar -> sky,1,,0,,0,19
986,i have an ear ache when showering,i have an  ea ache when showering,ear -> ea,1,,0,,0,6
987,i have a  hard muscle pain since i went to the gym,i have a heart muscle pain since i went to the gym,hard -> heart,1,,0,,0,11
988,when my       grand father died i felt a  hard emotional pain,when my grandfather ****** died i felt a heart emotional pain,grand -> grandfather; hard -> heart,2,father,1,,0,8
989,i need a kind of cream  wich make my muscles more relaxed,i need a kind of cream which make my muscles more relaxed,wich -> which,1,,0,,0,11
990,i feel something    hurt me  in taking breath and i cant take my breath,i feel something hurting me and taking breath and i cant take my breath,hurt -> hurting; in -> and,2,,0,,0,12
991,i have a pain in my head,i have a pain in my hand,head -> hand,1,,0,,0,6
992,every time i comb my hair there are so many hair in my comb,every time i comb my hair there are so many hair in my ****,,0,comb,1,,0,13
993,i used to be out of breath after going up a dozen of stairs but now i struggle to  breath even when i sit down,i used to be out of breath after going up a dozen of stairs but now i struggle to breathe even when i sit down,breath -> breathe,1,,0,,0,24
994,the warming system of my house is broken and  feel so cold,the warming system of my house is broken and feels so cold,feel -> feels,1,,0,,0,11
995,there is a sharp pain in my  bicep   i have tried to apply pain relief cream but it does not help,thats ** a sharp pain in my biceps ive **** tried to apply pain relief cream but it does not help,there -> thats; bicep -> biceps; i -> ive,3,is; have,2,,0,16
996,i have injured myself during the soccer match,i have injured myself during the   soka match,soccer -> soka,1,,0,,0,7
997,i was travelling by ship and i feel dizzy,i was  traveling by ship and i feel dizzy,travelling -> traveling,1,,0,,0,8
998,i have blurry vision after i used   a wrong medicine,i have blurry vision after i  use the wrong medicine,used -> use; a -> the,2,,0,,0,8
999,there is so much pain when i move my arm,theres ** so much pain when i move my arm,there -> theres,1,is,1,,0,8
1000,itch at front and center of scalp,itch at front and center of skype,scalp -> skype,1,,0,,0,6
1001,i feel pain in my head with   a vertigo,i feel pain in my head with the vertigo,a -> the,1,,0,,0,8
1002,i have a blurry vision and i cant see in the darkness  what is the reason doctor,i have a blurry vision and i cant see in the darkness whats ** the reason doctor,what -> whats,1,is,1,,0,15
1003,my hair isnt well,my hair isnt  wet,well -> wet,1,,0,,0,3
1004,i have a ear ache when i go to the pool,i have a  ea ache when i go to the pool,ear -> ea,1,,0,,0,10
1005,i have a neck pain when i sit ** infront of my laptop,i have a neck pain when i sit in   front of my laptop,infront -> front,1,,0,in,1,11
1006,i have disterbance in my  emotion,i have disturbance in my emotions,disterbance -> disturbance; emotion -> emotions,2,,0,,0,4
1007,my calves feel like they are  tight as knots and are throbbing,and calves feel like they are titers ** knots and are throbbing,my -> and; tight -> titers,2,as,1,,0,9
1008,i was diagnosed with pneumonia i cant  breath easily,i was diagnosed with pneumonia i cant breathe easily,breath -> breathe,1,,0,,0,8
1009,i feel   a pain on the left side of my chest where my heart is,i feel the pain on the left side of my chest where my heart is,a -> the,1,,0,,0,14
1010,when i  force my eyes to view i have blurry vision,when i forced my eyes to view i have blurry vision,force -> forced,1,,0,,0,10
1011,i dont do anything at home and still i feel exhausted,i dont do anything at home and still i feel   excused,exhausted -> excused,1,,0,,0,10
1012,i feel dizzy when i *** set infront of my laptop for an hour or two what possibly could be the reason,i feel dizzy when i sit  in   front of my laptop for an hour or two what possibly could be the reason,set -> in; infront -> front,2,,0,sit,1,19
1013,my shoulder has * agreat pain,my shoulder has a  great pain,agreat -> great,1,,0,a,1,4
1014,every time i comb my hair there are so many hair in my comb,every time i   cu my hair there are so many hair in my    c,comb -> cu; comb -> c,2,,0,,0,12
1015,my daughter had her eyebrows threaded and it pulled an opening of skin in one of her brows that is now puffy and oozing,my daughter had her eyebrows straight and it pulled an opening of skin in one of her brows that is  no puffy and oozing,threaded -> straight; now -> no,2,,0,,0,22
1016,i feel weak all over,i feel weak all  ova,over -> ova,1,,0,,0,4
1017,i started taking swimming lessons and i guess i swallowed too much water through my nose because this sinusitis is killing me  now,i started taking swimming lessons and i guess i   swallow too much water through my nose because  the      sciu is killing me over,swallowed -> swallow; this -> the; sinusitis -> sciu; now -> over,4,,0,,0,19
1018,i *** dont have full range of motion with my arms,i don    t have full range of motion with my arms,dont -> t,1,,0,don,1,9
1019,i have a great stomach ache and i cant eat      any thing,i have a great stomach    h and i cant eat anything *****,ache -> h; any -> anything,2,thing,1,,0,9
1020,i felt my heart hurts when i ran for * along distance,i felt my heart hurts when i run for a  long distance,ran -> run; along -> long,2,,0,a,1,9
1021,i was travelling by ship and i feel dizzy,i was  traveling by ship and i feel dizzy,travelling -> traveling,1,,0,,0,8
1022,i got injured exercising,i got  inured exercising,injured -> inured,1,,0,,0,3
1023,my nose is congested all the time and theres this gluey secretion in my throat that makes it impossible for me to sleep i often have to nap sitting down,my nose is  constant all the time and theres this ***** secretion in my throat that makes it impossible for me to sleep i often have to nap sitting down,congested -> constant,1,gluey,1,,0,28
1024,i am having running nose,i am having   runny nose,running -> runny,1,,0,,0,4
1025,my neck is annoying me i cant sleep bacause of it,my neck is annoying me i cant sleep because of it,bacause -> because,1,,0,,0,10
1026,i have a  hard muscle pain since i went to the gym,i have a heart muscle pain since i went to the gym,hard -> heart,1,,0,,0,11
1027,i felt my heart hurts when i ran for * along distance,* felt my heart hurts when i ran for a  long distance,along -> long,1,i,1,a,1,9
1028,my neck is annoying me i cant sleep bacause of it,my neck is annoying me i cant sleep because of it,bacause -> because,1,,0,,0,10
1029,i feel dizzy when i *** set infront of my laptop for an hour or two what possibly could be the reason,* **** dizzy when i sit  in   front of my laptop for an hour or two   or possibly could be the reason,set -> in; infront -> front; what -> or,3,i; feel,2,sit,1,16
1030,i have acne in my face and other ******* problema in my derma like itching,i have acne in my face and other problem       uh in my derma like itching,problema -> uh,1,,0,problem,1,13
1031,i feel      a pain in my back when i sit on a chair for long,i have cloudy eyes ** ** **** **** * *** ** * ***** *** ****,feel -> have; a -> cloudy; pain -> eyes,3,in; my; back; when; i; sit; on; a; chair; for; long,11,,0,1
1032,when i sneeze very hard i feel     ear ache,when i sneeze very hard i feel earache ****,ear -> earache,1,ache,1,,0,7
1033,when i extend  my       leg there is pain in knee joint,**** i   have the insurance ***** ** **** ** **** *****,extend -> have; my -> the; leg -> insurance,3,when; there; is; pain; in; knee; joint,7,,0,1
1034,my  son squeezed a pimple and it broke open only to  scab over and now looks   like   it     is infected,its hard ******** * ****** *** ** ***** **** **** to stand   up and   i    am moving very slowly ********,my -> its; son -> hard; scab -> stand; over -> up; now -> i; looks -> am; like -> moving; it -> very; is -> slowly,9,squeezed; a; pimple; and; it; broke; open; only; infected,9,,0,2
1035,i need    a kind of cream  wich  make my muscles more relaxed,i need that kind of cream which makes my muscles more relaxed,a -> that; wich -> which; make -> makes,3,,0,,0,9
1036,i feel joint pain every time  i move,i feel  like   my heart   is on fire,joint -> like; pain -> my; every -> heart; time -> is; i -> on; move -> fire,6,,0,,0,2
1037,had i stepped on a needle it wouldnt have   hurt   so much like this damned spur in my heel,*** i ******* ** * ****** ** ******* have cloudy eyes **** **** **** ****** **** ** ** ****,hurt -> cloudy; so -> eyes,2,had; stepped; on; a; needle; it; wouldnt; much; like; this; damned; spur; in; my; heel,15,,0,2
1038,its hard to stand up and * im moving very slowly,its hard to stand up and i am moving very slowly,im -> am,1,,0,i,1,9
1039,i tried to put my glasses to see more clear but cant find any change,pain    in ** *** my stomach ** *** **** ***** *** **** **** *** ******,i -> pain; tried -> in; glasses -> stomach,3,to; put; to; see; more; clear; but; cant; find; any; change,11,,0,1
1040,**** i   have    a back pain since i fell on the floor,when i sneeze very hard **** ***** i feel  a *** *****,have -> sneeze; a -> very; back -> hard; fell -> feel; on -> a,5,pain; since; the; floor,4,when,1,2
1041,i fell off my   bike and since then  i had hard    knee pain,i flew off my biking *** since been on   a hard weekend ****,fell -> flew; bike -> biking; then -> been; i -> on; had -> a; knee -> weekend,6,and; pain,2,,0,5
1042,i have    for  dia,i have cloudy eyes,for -> cloudy; dia -> eyes,2,,0,,0,2
1043,why   is my shoulder aching when  i    try   to   pick up the laundry,its hard to    stand     up  and im moving very slowly ** *** *******,why -> its; is -> hard; my -> to; shoulder -> stand; aching -> up; when -> and; i -> im; try -> moving; to -> very; pick -> slowly,10,up; the; laundry,3,,0,0
1044,i often get a sharp pain in my chest and i cant tell what im doing that might be triggering it,i  have *** a ***** pain in my  head *** * **** **** **** ** ***** **** ***** ** ********** **,often -> have; chest -> head,2,get; sharp; and; i; cant; tell; what; im; doing; that; might; be; triggering; it,14,,0,5
1045,i have muscle pain at my left leg,i have muscle pain in my left leg,at -> in,1,,0,,0,7
1046,my shoulder muscle hurts when i  try      to reach up,when        i sneeze  very hard i feel earache ***** **,my -> when; shoulder -> i; muscle -> sneeze; hurts -> very; when -> hard; try -> feel; to -> earache,7,reach; up,2,,0,1
1047,** *** **** ** ***** ** there is acne     on   my   face,it its hard to stand up   and  i   am moving very slowly,there -> and; is -> i; acne -> am; on -> moving; my -> very; face -> slowly,6,,0,it; its; hard; to; stand; up,6,0
1048,i have this strange     rash on my arm,i have    a    pain internal ** ** ***,this -> a; strange -> pain; rash -> internal,3,on; my; arm,3,,0,2
1049,i feel that  its hard   to breath  for me specially after running or making any effort,there   is   so much pain when      i move my       arm ***** ******* ** ****** *** ******,i -> there; feel -> is; that -> so; its -> much; hard -> pain; to -> when; breath -> i; for -> move; me -> my; specially -> arm,10,after; running; or; making; any; effort,6,,0,0
1050,when i  was washing   my     hair it was falling out heavily,**** i have       a pain internal ** *** ******* *** *******,was -> have; washing -> a; my -> pain; hair -> internal,4,when; it; was; falling; out; heavily,6,,0,1
1051,it feels like someone stuck a knife     into my shoulder,i  have **** ******* ***** a  pain internal ** ********,it -> i; feels -> have; knife -> pain; into -> internal,4,like; someone; stuck; my; shoulder,5,,0,1
1052,* **** * redness swelling and difficulty walking,i feel a   sharp     pain  in         my stomach,redness -> sharp; swelling -> pain; and -> in; difficulty -> my; walking -> stomach,5,,0,i; feel; a,3,0
1053,when i move my shoulder its like **** lightning  is being sent through my shoulder,when i move my shoulder its like like        me its being sent      to my shoulder,lightning -> me; is -> its; through -> to,3,,0,like,1,11
1054,there pain in my foot,nerve pain in my foot,there -> nerve,1,,0,,0,4
1055,sometimes i cough because * im a smoker,sometimes i cough because i am a smoker,im -> am,1,,0,i,1,6
1056,my shower drain   is full of hair every time,my shower drain this full of hair every time,is -> this,1,,0,,0,8
1057,my television and  computer seem out of focus even though i have new glasses,my television and computers seem out of focus even though i have new glasses,computer -> computers,1,,0,,0,13
1058,i have a break in the skin inside one of my nostrils that has become infected and ** is now filled with pus,i have a break in the skin inside one of my  nostril that has become infected and it is now filled with pus,nostrils -> nostril,1,,0,it,1,21
1059,i complain * alot with my neck pain and i really need to be better,i complain a  lot with my neck pain and i really need to be better,alot -> lot,1,,0,a,1,13
1060,my stomach feels starts hurting but then it feels better after i eat something **** mild,my stomach feels starts hurting but then it feels better after i eat something with milk,mild -> milk,1,,0,with,1,14
1061,chronic bone disease at the level of the doubles of the lower estremidades,chronic bone disease at the level of the doubles of the lower     extremis,estremidades -> extremis,1,,0,,0,12
1062,my hair is falling when i am      combing it,my hair is falling when i am accommodated **,combing -> accommodated,1,it,1,,0,7
1063,sometimes i feel like a claw on my chest that leaves me breathless,sometimes i feel like a clog on my chest that leaves me breathless,claw -> clog,1,,0,,0,12
1064,my son had his lip pierced and  it is swollen and the skin inside on his lip is grey and looks infected,my son had his lip pierced and its ** swollen and the skin inside of his lip is gray and looks infected,it -> its; on -> of; grey -> gray,3,is,1,,0,18
1065,i have pimples  in patches along with a lot of redness on my face,i have pimples and patches along with a lot of redness on my face,in -> and,1,,0,,0,13
1066,* im having a hard time reading because the letters are all    fuzzy,i am having a hard time reading because the letters are all possible,im -> am; fuzzy -> possible,2,,0,i,1,10
1067,i was  kicked in the head playing soccer last night,i was kidding ** the head playing soccer last night,kicked -> kidding,1,in,1,,0,8
1068,i get terrible headaches every few months and when i get them my vision is affected,i get terrible  headache every few months and when i get them my vision is affected,headaches -> headache,1,,0,,0,15
1069,i fell a stiffness in my elbows and shoulders,i felt a stiffness in my elbows and shoulders,fell -> felt,1,,0,,0,8
1070,i got a divorce last year and i just cant stop dwelling on how to ** get revenge on my ex husband,i got a divorce last year and i just cant stop dwelling on how to to get revenge on my ex husband,,0,,0,to,1,21
1071,im suffering from * sharp cough accompanied by phlegm,im suffering from a sharp cough accompanied by   plan,phlegm -> plan,1,,0,a,1,7
1072,i have a pain in my  joint,i have a pain in my joints,joint -> joints,1,,0,,0,6
1073,when i brush my hair i  notice big clumps of hair coming out in the brush,when i brush my hair i noticed big  clums of hair coming out in the brush,notice -> noticed; clumps -> clums,2,,0,,0,14
1074,i have a  split on my thumb that will not heal,i have a splint on my thumb that will not heal,split -> splint,1,,0,,0,10
1075,chronic disease of hair follicles and sebaceous glands,chronic disease of hair follicles  in sebaceous glands,and -> in,1,,0,,0,7
1076,my stomach aches after i drink any **** soda drink why,my stomach aches after i drink any sort   of drink why,soda -> of,1,,0,sort,1,9
1077,i feel discomfort ******* throughout the body in general,i feel discomfort through        how the body in general,throughout -> how,1,,0,through,1,7
1078,i was playing football and ******* injuried with joint pain,i was playing football and injured       it with joint pain,injuried -> it,1,,0,injured,1,8
1079,i have tried to  relief it but i cant,i have tried to relieve it but i cant,relief -> relieve,1,,0,,0,8
1080,i feel like i went to an  acupunctures practice and had one hundred needles in my shoulder,i feel like i went to an acupuncturist practice and had one hundred needles in my shoulder,acupunctures -> acupuncturist,1,,0,,0,16
1081,i have a cut that has ** become  red and oozes puss,i have a cat that has to become bred and     s puss,cut -> cat; red -> bred; oozes -> s,3,,0,to,1,8
1082,i cant see the  sign i have a blurry vision,i cant see the signs i have a blurry vision,sign -> signs,1,,0,,0,9
1083,i complain * alot with skin allergy,i complain a  lot with skin allergy,alot -> lot,1,,0,a,1,5
1084,i cut my hand a couple of days ago and although i didnt think  i needed it stitches it hasnt closed up,i cut my head a couple ** days ago and although i didnt think it needed ** stitches it hasnt closed up,hand -> head; i -> it,2,of; it,2,,0,18
1085,* im not hearing well i have ** problem with   my  ear,i am not hearing well i have oh    yeah yeah yeah yeah,im -> am; problem -> yeah; with -> yeah; my -> yeah; ear -> yeah,5,,0,i; oh,2,5
1086,i feel like l fell in hot water,i feel like i fell in hot water,l -> i,1,,0,,0,7
1087,have * severe cold and cough,have a severe cold and cough,,0,,0,a,1,5
1088,my foot had been  aching since last   tuesday,my foot *** been itching since last wednesday,aching -> itching; tuesday -> wednesday,2,had,1,,0,5
1089,*  ive tried reading books but nothing can cheer me up,i have tried reading books but nothing  uh ***** ** **,ive -> have; can -> uh,2,cheer; me; up,3,i,1,5
1090,my  kee is swallowing which indicates i have an infected wound,my knee is    swollen which indicates i have an infected  bone,kee -> knee; swallowing -> swollen; wound -> bone,3,,0,,0,8
1091,i have found some issues in my skin and tried to use cream but it ** **** doesnt get better,i have found some issues in my skin and tried to use cream but it is does    not get better,doesnt -> not,1,,0,is; does,2,17
1092,when i stand i feel dizzy i ****   do not know why,when i stand i feel dizzy i dont want  to know why,do -> want; not -> to,2,,0,dont,1,9
1093,everything looks like beeing  in a smoky area,everything looks like  being any * smoky ****,beeing -> being; in -> any,2,a; area,2,,0,4
1094,i have    a red rash that is itchy on my skin,i have read the rash that it    it on my skin,a -> read; red -> the; is -> it; itchy -> it,4,,0,,0,7
1095,i feel like the world goes ***** round and round,i feel like *** world goes round round and round,,0,the,1,round,1,8
1096,i have ** **** * **** pain like needles in my joints,i have no pain i have pain like needles in my joints,,0,,0,no; pain; i; have,4,8
1097,i  notice a lot ** more hair coming out than usual when i brush my hair,i noticed a lot uh more hair   ming out than usual when i brush my hair,notice -> noticed; coming -> ming,2,,0,uh,1,13
1098,i feel cold when * ** ***** **** the night comes,i feel cold when i at night when the night comes,,0,,0,i; at; night; when,4,7
1099,my  heart hurts while im  sad why,my hearts  went while  i said why,heart -> hearts; hurts -> went; im -> i; sad -> said,4,,0,,0,3
1100,i have   a  hard pain in my stomach,i have had heart pain in my *******,a -> had; hard -> heart,2,stomach,1,,0,5
1101,*  ive noticed my hair falling out a lot lately,i have noticed my hair falling out a lot lately,ive -> have,1,,0,i,1,8
1102,i always feel * like   i have menstrual pains even if i ***** dont have my period,i always feel i like one   st      pain ***** even if i found   my have my period,i -> one; have -> st; menstrual -> pain; dont -> my,4,pains,1,i; found,2,10
1103,i feel a great pain in my shoulder joint and it does not go away,i have a great pain in my shoulder joint and it does not go away,feel -> have,1,,0,,0,14
1104,in **** highschool i **** * * had a lot of   acne,in high     school i have a i had a lot of accent,highschool -> school; acne -> accent,2,,0,high; have; a; i,4,6
1105,heart aches so much,heart    is so much,aches -> is,1,,0,,0,3
1106,my  shoulder aches when i try to lift five pounds,my shoulders aches when i try to lift five    lbs,shoulder -> shoulders; pounds -> lbs,2,,0,,0,8
1107,the worst headache was during a hangover in my twenties i   sincerely thought i was going to die from brain inflammation,the worst headache was during a hangover in ** twenties i essentially thought i was going to die from brain inflammation,sincerely -> essentially,1,my,1,,0,19
1108,my hair always falls out and i have lost a lot of  hair lately,my hair always falls out and i have lost a lot of hairs lately,hair -> hairs,1,,0,,0,13
1109,i had internal pain and  gases when i ate indian **** spicy food yesterday,i had internal pain and gasses when i ate indian this    is food yesterday,gases -> gasses; spicy -> is,2,,0,this,1,11
1110,i feel a great amount of pressure on the sides of my neck,i feel * great amount of pressure on the  side of my neck,sides -> side,1,a,1,,0,11
1111,every time i make an effort i felt dizzy,every time i make an effort i feel dizzy,felt -> feel,1,,0,,0,8
1112,i feel  aching on my insides,i feel itching on my  inside,aching -> itching; insides -> inside,2,,0,,0,4
1113,i have a headache almost ****** every day,i have a headache almost almost every day,,0,,0,almost,1,7
1114,i feel like something is squeezing ****  my lungs,i feel like something is squeezing down the lungs,my -> the,1,,0,down,1,7
1115,my ** body feels like its in   a refrigerator,my my body feels like its in our refrigerator,a -> our,1,,0,my,1,7
1116,i cut my foot ** at the pool and it breaks ** open every day when i walk on it,i cut my foot to at the pool and it breaks it open every day when i walk on it,,0,,0,to; it,2,18
1117,my chest hurts when i go **** to take a  breath,my chest hurts when i go home to take a breathe,breath -> breathe,1,,0,home,1,9
1118,i wish this excruciating feeling of loss could ** go away,i wish this excruciating feeling of loss could do go away,,0,,0,do,1,10
1119,i have a  migrain and i took **** * panadol but *   it doesnt help,i have a migraine *** i took iran a     lot but i does      not help,migrain -> migraine; panadol -> lot; it -> does; doesnt -> not,4,and,1,iran; a; i,3,7
1120,i hit the ground when trying to shoot a basketball,i hit the ground  and trying to shoot a     basket,when -> and; basketball -> basket,2,,0,,0,8
1121,when * im too high i start to feel dizzy,when i am too high i start to feel dizzy,im -> am,1,,0,i,1,8
1122,there is a sharp pain in my  bicep i have tried to apply pain relief cream but it does not help,there is a sharp pain in my biceps i have tried to apply pain relief cream but it does not help,bicep -> biceps,1,,0,,0,20
1123,i have a rash on my skin,i  had a rash oh my skin,have -> had; on -> oh,2,,0,,0,5
1124,i feel a sharp pain in the stomach after eating,i feel a sharp pain in the stomach after     it,eating -> it,1,,0,,0,9
1125,i have a back pain since i turned seventy years old,i have a back pain since i turned  twenty years old,seventy -> twenty,1,,0,,0,10
1126,i have a pain in my  muscle,i have a pain in my muscles,muscle -> muscles,1,,0,,0,6
1127,my child has cough all night *** she cant sleep,my child has cough all night and she cant sleep,,0,,0,and,1,9
1128,i feel like *  ive always got something in my throat,i feel like i have always got something in my throat,ive -> have,1,,0,i,1,9
1129,i cant walk well i have an ache in my foot,i cant walk well i have an acne in my foot,ache -> acne,1,,0,,0,10
1130,there is a constant tickle in  my throat,there is a constant tickle in the throat,my -> the,1,,0,,0,7
1131,i may have overdone it with the ******* ****** weightlifting because i am afraid i may have torn a muscle on my back,i may have overdone it with the wedding weight       lifting because i am afraid i may have torn a muscle on my back,weightlifting -> lifting,1,,0,wedding; weight,2,20
1132,i feel emotionally crushed,i feel emotionally trusted,crushed -> trusted,1,,0,,0,3
1133,my body aches on  the inside between my hips and shoulders,my body    is on this inside between my  hip and  shoulder,aches -> is; the -> this; hips -> hip; shoulders -> shoulder,4,,0,,0,7
1134,there are times when i feel crushed under a huge weight and no air passing to my lungs it actually scares the hell out of **   me when it happens,there are times when i feel pressed under a huge weight and no air passing on my lungs  i actually scares the hell out of my knee when it happens,crushed -> pressed; to -> on; it -> i; me -> knee,4,,0,my,1,25
1135,my throught is so sore,my   throat is so ****,throught -> throat,1,sore,1,,0,3
1136,i walked a long for three         km i feel pain in my foot like foot ache,i walked a long for three kilometers i feel pain in my foot like foot  and,km -> kilometers; ache -> and,2,,0,,0,14
1137,i get * *** big patches of irritated pimples on my back and they hurt **,i get i get big patches of irritated pimples on my back and they hurt it,,0,,0,i; get; it,3,13
